<?xml version='1.0' encoding='utf-8'?>

<classInfo classId="15" name="Cleric" classLevel="20" parent="10" xmlns:xsi="http://www.w3.org/2001/XMLSchema-instance" xmlns="http://la2j.org" xsi:schemaLocation="http://la2j.org ../schema/classInfo.xsd">
    <level value="20" hp="424.0" mp="192.0" cp="212.0" hpRegen="3.4" mpRegen="1.2" cpRegen="2.5" />
    <level value="21" hp="458.1" mp="205.2" cp="229.05" hpRegen="3.5" mpRegen="1.5" cpRegen="3.5" />
    <level value="22" hp="492.51" mp="218.52" cp="246.255" hpRegen="3.6" mpRegen="1.5" cpRegen="3.5" />
    <level value="23" hp="527.23" mp="231.96" cp="263.615" hpRegen="3.7" mpRegen="1.5" cpRegen="3.5" />
    <level value="24" hp="562.26" mp="245.52" cp="281.13" hpRegen="3.8" mpRegen="1.5" cpRegen="3.5" />
    <level value="25" hp="597.6" mp="259.2" cp="298.8" hpRegen="3.9" mpRegen="1.5" cpRegen="3.5" />
    <level value="26" hp="633.25" mp="273.0" cp="316.625" hpRegen="4.0" mpRegen="1.5" cpRegen="3.5" />
    <level value="27" hp="669.21" mp="286.92" cp="334.605" hpRegen="4.1" mpRegen="1.5" cpRegen="3.5" />
    <level value="28" hp="705.48" mp="300.96" cp="352.74" hpRegen="4.2" mpRegen="1.5" cpRegen="3.5" />
    <level value="29" hp="742.06" mp="315.12" cp="371.03" hpRegen="4.3" mpRegen="1.5" cpRegen="3.5" />
    <level value="30" hp="778.95" mp="329.4" cp="389.475" hpRegen="4.4" mpRegen="1.5" cpRegen="3.5" />
    <level value="31" hp="816.15" mp="343.8" cp="408.075" hpRegen="4.5" mpRegen="1.8" cpRegen="4.5" />
    <level value="32" hp="853.66" mp="358.32" cp="426.83" hpRegen="4.6" mpRegen="1.8" cpRegen="4.5" />
    <level value="33" hp="891.48" mp="372.96" cp="445.74" hpRegen="4.7" mpRegen="1.8" cpRegen="4.5" />
    <level value="34" hp="929.61" mp="387.72" cp="464.805" hpRegen="4.8" mpRegen="1.8" cpRegen="4.5" />
    <level value="35" hp="968.05" mp="402.6" cp="484.025" hpRegen="4.9" mpRegen="1.8" cpRegen="4.5" />
    <level value="36" hp="1006.8" mp="417.6" cp="503.4" hpRegen="5.0" mpRegen="1.8" cpRegen="4.5" />
    <level value="37" hp="1045.86" mp="432.72" cp="522.93" hpRegen="5.1" mpRegen="1.8" cpRegen="4.5" />
    <level value="38" hp="1085.23" mp="447.96" cp="542.615" hpRegen="5.2" mpRegen="1.8" cpRegen="4.5" />
    <level value="39" hp="1124.91" mp="463.32" cp="562.455" hpRegen="5.3" mpRegen="1.8" cpRegen="4.5" />
    <level value="40" hp="1164.9" mp="478.8" cp="582.45" hpRegen="5.4" mpRegen="1.8" cpRegen="4.5" />
    <level value="41" hp="1205.2" mp="494.4" cp="602.6" hpRegen="5.5" mpRegen="2.1" cpRegen="5.5" />
    <level value="42" hp="1245.81" mp="510.12" cp="622.905" hpRegen="5.6" mpRegen="2.1" cpRegen="5.5" />
    <level value="43" hp="1286.73" mp="525.96" cp="643.365" hpRegen="5.7" mpRegen="2.1" cpRegen="5.5" />
    <level value="44" hp="1327.96" mp="541.92" cp="663.98" hpRegen="5.8" mpRegen="2.1" cpRegen="5.5" />
    <level value="45" hp="1369.5" mp="558.0" cp="684.75" hpRegen="5.9" mpRegen="2.1" cpRegen="5.5" />
    <level value="46" hp="1411.35" mp="574.2" cp="705.675" hpRegen="6.0" mpRegen="2.1" cpRegen="5.5" />
    <level value="47" hp="1453.51" mp="590.52" cp="726.755" hpRegen="6.1" mpRegen="2.1" cpRegen="5.5" />
    <level value="48" hp="1495.98" mp="606.96" cp="747.99" hpRegen="6.2" mpRegen="2.1" cpRegen="5.5" />
    <level value="49" hp="1538.76" mp="623.52" cp="769.38" hpRegen="6.3" mpRegen="2.1" cpRegen="5.5" />
    <level value="50" hp="1581.85" mp="640.2" cp="790.925" hpRegen="6.4" mpRegen="2.1" cpRegen="5.5" />
    <level value="51" hp="1625.25" mp="657.0" cp="812.625" hpRegen="6.5" mpRegen="2.4" cpRegen="6.5" />
    <level value="52" hp="1668.96" mp="673.92" cp="834.48" hpRegen="6.6" mpRegen="2.4" cpRegen="6.5" />
    <level value="53" hp="1712.98" mp="690.96" cp="856.49" hpRegen="6.7" mpRegen="2.4" cpRegen="6.5" />
    <level value="54" hp="1757.31" mp="708.12" cp="878.655" hpRegen="6.8" mpRegen="2.4" cpRegen="6.5" />
    <level value="55" hp="1801.95" mp="725.4" cp="900.975" hpRegen="6.9" mpRegen="2.4" cpRegen="6.5" />
    <level value="56" hp="1846.9" mp="742.8" cp="923.45" hpRegen="7.0" mpRegen="2.4" cpRegen="6.5" />
    <level value="57" hp="1892.16" mp="760.32" cp="946.08" hpRegen="7.1" mpRegen="2.4" cpRegen="6.5" />
    <level value="58" hp="1937.73" mp="777.96" cp="968.865" hpRegen="7.2" mpRegen="2.4" cpRegen="6.5" />
    <level value="59" hp="1983.61" mp="795.72" cp="991.805" hpRegen="7.3" mpRegen="2.4" cpRegen="6.5" />
    <level value="60" hp="2029.8" mp="813.6" cp="1014.9" hpRegen="7.4" mpRegen="2.4" cpRegen="6.5" />
    <level value="61" hp="2076.3" mp="831.6" cp="1038.15" hpRegen="7.5" mpRegen="2.7" cpRegen="7.5" />
    <level value="62" hp="2123.11" mp="849.72" cp="1061.555" hpRegen="7.6" mpRegen="2.7" cpRegen="7.5" />
    <level value="63" hp="2170.23" mp="867.96" cp="1085.115" hpRegen="7.7" mpRegen="2.7" cpRegen="7.5" />
    <level value="64" hp="2217.66" mp="886.32" cp="1108.83" hpRegen="7.8" mpRegen="2.7" cpRegen="7.5" />
    <level value="65" hp="2265.4" mp="904.8" cp="1132.7" hpRegen="7.9" mpRegen="2.7" cpRegen="7.5" />
    <level value="66" hp="2313.45" mp="923.4" cp="1156.725" hpRegen="8.0" mpRegen="2.7" cpRegen="7.5" />
    <level value="67" hp="2361.81" mp="942.12" cp="1180.905" hpRegen="8.1" mpRegen="2.7" cpRegen="7.5" />
    <level value="68" hp="2410.48" mp="960.96" cp="1205.24" hpRegen="8.2" mpRegen="2.7" cpRegen="7.5" />
    <level value="69" hp="2459.46" mp="979.92" cp="1229.73" hpRegen="8.3" mpRegen="2.7" cpRegen="7.5" />
    <level value="70" hp="2508.75" mp="999.0" cp="1254.375" hpRegen="8.4" mpRegen="2.7" cpRegen="7.5" />
    <level value="71" hp="2558.35" mp="1018.2" cp="1279.175" hpRegen="8.5" mpRegen="3.0" cpRegen="8.5" />
    <level value="72" hp="2608.26" mp="1037.52" cp="1304.13" hpRegen="8.6" mpRegen="3.0" cpRegen="8.5" />
    <level value="73" hp="2658.48" mp="1056.96" cp="1329.24" hpRegen="8.7" mpRegen="3.0" cpRegen="8.5" />
    <level value="74" hp="2709.01" mp="1076.52" cp="1354.505" hpRegen="8.8" mpRegen="3.0" cpRegen="8.5" />
    <level value="75" hp="2759.85" mp="1096.2" cp="1379.925" hpRegen="8.9" mpRegen="3.0" cpRegen="8.5" />
    <level value="76" hp="2811.0" mp="1116.0" cp="1405.5" hpRegen="9.0" mpRegen="3.0" cpRegen="8.5" />
    <level value="77" hp="2862.46" mp="1135.92" cp="1431.23" hpRegen="9.1" mpRegen="3.0" cpRegen="8.5" />
    <level value="78" hp="2914.23" mp="1155.96" cp="1457.115" hpRegen="9.2" mpRegen="3.0" cpRegen="8.5" />
    <level value="79" hp="2966.31" mp="1176.12" cp="1483.155" hpRegen="9.3" mpRegen="3.0" cpRegen="8.5" />
    <level value="80" hp="3018.7" mp="1196.4" cp="1509.35" hpRegen="9.4" mpRegen="3.0" cpRegen="8.5" />
    <level value="81" hp="3071.4" mp="1216.8" cp="1535.7" hpRegen="9.5" mpRegen="3.0" cpRegen="8.5" />
    <level value="82" hp="3124.41" mp="1237.32" cp="1562.205" hpRegen="9.6" mpRegen="3.0" cpRegen="8.5" />
    <level value="83" hp="3177.73" mp="1257.96" cp="1588.865" hpRegen="9.7" mpRegen="3.0" cpRegen="8.5" />
    <level value="84" hp="3231.36" mp="1278.72" cp="1615.68" hpRegen="9.8" mpRegen="3.0" cpRegen="8.5" />
    <level value="85" hp="3285.3" mp="1299.6" cp="1642.65" hpRegen="9.9" mpRegen="3.0" cpRegen="8.5" />
</classInfo>