<?xml version='1.0' encoding='utf-8'?>
<classInfo classId="0" name="Human Fighter" classLevel="1" xmlns:xsi="http://www.w3.org/2001/XMLSchema-instance"  xmlns="http://la2j.org" xsi:schemaLocation="http://la2j.org ../schema/classInfo.xsd">
    <level value="1"   hp="80"      mp="30"     cp="32"      hpRegen="2.0"  mpRegen="0.9" cpRegen="2.0" />
    <level value="2"   hp="91.83"   mp="35.46"  cp="36.732"  hpRegen="2.05" mpRegen="0.9" cpRegen="2.0"/>
    <level value="3"   hp="103.79"  mp="40.98"  cp="1.516"   hpRegen="2.1"  mpRegen="0.9" cpRegen="2.0"/>
    <level value="4"   hp="115.88"  mp="46.56"  cp="6.352"   hpRegen="2.15" mpRegen="0.9" cpRegen="2.0"/>
    <level value="5"   hp="128.1"   mp="52.2"   cp="1.24"    hpRegen="2.2"  mpRegen="0.9" cpRegen="2.0"/>
    <level value="6"   hp="140.45"  mp="57.9"   cp="6.18"    hpRegen="2.25" mpRegen="0.9" cpRegen="2.0"/>
    <level value="7"   hp="152.93"  mp="63.66"  cp="1.172"   hpRegen="2.3"  mpRegen="0.9" cpRegen="2.0"/>
    <level value="8"   hp="165.54"  mp="69.48"  cp="6.216"   hpRegen="2.35" mpRegen="0.9" cpRegen="2.0"/>
    <level value="9"   hp="178.28"  mp="75.36"  cp="1.312"   hpRegen="2.4"  mpRegen="0.9" cpRegen="2.0"/>
    <level value="10"  hp="191.15"  mp="81.3"   cp="6.46"    hpRegen="2.45" mpRegen="0.9" cpRegen="2.0"/>
    <level value="11"  hp="204.15"  mp="87.3"   cp="1.66"    hpRegen="2.5"  mpRegen="1.2" cpRegen="2.5"/>
    <level value="12"  hp="217.28"  mp="93.36"  cp="6.912"   hpRegen="2.6"  mpRegen="1.2" cpRegen="2.5"/>
    <level value="13"  hp="230.54"  mp="99.48"  cp="2.216"   hpRegen="2.7"  mpRegen="1.2" cpRegen="2.5"/>
    <level value="14"  hp="243.93"  mp="105.66" cp="7.572"   hpRegen="2.8"  mpRegen="1.2" cpRegen="2.5"/>
    <level value="15"  hp="257.45"  mp="111.9"  cp="02.98"   hpRegen="2.9"  mpRegen="1.2" cpRegen="2.5"/>
    <level value="16"  hp="271.1"   mp="118.2"  cp="08.44"   hpRegen="3.0"  mpRegen="1.2" cpRegen="2.5"/>
    <level value="17"  hp="284.88"  mp="124.56" cp="13.952"  hpRegen="3.1"  mpRegen="1.2" cpRegen="2.5"/>
    <level value="18"  hp="298.79"  mp="130.98" cp="19.516"  hpRegen="3.2"  mpRegen="1.2" cpRegen="2.5"/>
    <level value="19"  hp="312.83"  mp="137.46" cp="25.132"  hpRegen="3.3"  mpRegen="1.2" cpRegen="2.5"/>
    <level value="20"  hp="327.0"   mp="144.0"  cp="30.8"    hpRegen="3.4"  mpRegen="1.2" cpRegen="2.5"/>
    <level value="21"  hp="341.3"   mp="150.6"  cp="36.52"   hpRegen="3.5"  mpRegen="1.5" cpRegen="3.5"/>
    <level value="22"  hp="355.73"  mp="157.26" cp="42.292"  hpRegen="3.6"  mpRegen="1.5" cpRegen="3.5"/>
    <level value="23"  hp="370.29"  mp="163.98" cp="48.116"  hpRegen="3.7"  mpRegen="1.5" cpRegen="3.5"/>
    <level value="24"  hp="384.98"  mp="170.76" cp="53.992"  hpRegen="3.8"  mpRegen="1.5" cpRegen="3.5"/>
    <level value="25"  hp="399.8"   mp="177.6"  cp="159.92"  hpRegen="3.9"  mpRegen="1.5" cpRegen="3.5"/>
    <level value="26"  hp="414.75"  mp="184.5"  cp="165.9"   hpRegen="4.0"  mpRegen="1.5" cpRegen="3.5"/>
    <level value="27"  hp="429.83"  mp="191.46" cp="171.932" hpRegen="4.1"  mpRegen="1.5" cpRegen="3.5"/>
    <level value="28"  hp="445.04"  mp="198.48" cp="178.016" hpRegen="4.2"  mpRegen="1.5" cpRegen="3.5"/>
    <level value="29"  hp="460.38"  mp="205.56" cp="184.152" hpRegen="4.3"  mpRegen="1.5" cpRegen="3.5"/>
    <level value="30"  hp="475.85"  mp="212.7"  cp="190.34"  hpRegen="4.4"  mpRegen="1.5" cpRegen="3.5"/>
    <level value="31"  hp="491.45"  mp="219.9"  cp="196.58"  hpRegen="4.5"  mpRegen="1.8" cpRegen="4.5"/>
    <level value="32"  hp="507.18"  mp="227.16" cp="202.872" hpRegen="4.6"  mpRegen="1.8" cpRegen="4.5"/>
    <level value="33"  hp="523.04"  mp="234.48" cp="209.216" hpRegen="4.7"  mpRegen="1.8" cpRegen="4.5"/>
    <level value="34"  hp="539.03"  mp="241.86" cp="215.612" hpRegen="4.8"  mpRegen="1.8" cpRegen="4.5"/>
    <level value="35"  hp="555.15"  mp="249.3"  cp="222.06"  hpRegen="4.9"  mpRegen="1.8" cpRegen="4.5"/>
    <level value="36"  hp="571.4"   mp="256.8"  cp="228.56"  hpRegen="5.0"  mpRegen="1.8" cpRegen="4.5"/>
    <level value="37"  hp="587.78"  mp="264.36" cp="235.112" hpRegen="5.1"  mpRegen="1.8" cpRegen="4.5"/>
    <level value="38"  hp="604.29"  mp="271.98" cp="241.716" hpRegen="5.2"  mpRegen="1.8" cpRegen="4.5"/>
    <level value="39"  hp="620.93"  mp="279.66" cp="248.372" hpRegen="5.3"  mpRegen="1.8" cpRegen="4.5"/>
    <level value="40"  hp="637.7"   mp="287.4"  cp="255.08"  hpRegen="5.4"  mpRegen="1.8" cpRegen="4.5"/>
    <level value="41"  hp="654.6"   mp="295.2"  cp="261.84"  hpRegen="5.5"  mpRegen="2.1" cpRegen="5.5"/>
    <level value="42"  hp="671.63"  mp="303.06" cp="268.652" hpRegen="5.6"  mpRegen="2.1" cpRegen="5.5"/>
    <level value="43"  hp="688.79"  mp="310.98" cp="275.516" hpRegen="5.7"  mpRegen="2.1" cpRegen="5.5"/>
    <level value="44"  hp="706.08"  mp="318.96" cp="282.432" hpRegen="5.8"  mpRegen="2.1" cpRegen="5.5"/>
    <level value="45"  hp="723.5"   mp="327.0"  cp="289.4"   hpRegen="5.9"  mpRegen="2.1" cpRegen="5.5"/>
    <level value="46"  hp="741.05"  mp="335.1"  cp="296.42"  hpRegen="6.0"  mpRegen="2.1" cpRegen="5.5"/>
    <level value="47"  hp="758.73"  mp="343.26" cp="303.492" hpRegen="6.1"  mpRegen="2.1" cpRegen="5.5"/>
    <level value="48"  hp="776.54"  mp="351.48" cp="310.616" hpRegen="6.2"  mpRegen="2.1" cpRegen="5.5"/>
    <level value="49"  hp="794.48"  mp="359.76" cp="317.792" hpRegen="6.3"  mpRegen="2.1" cpRegen="5.5"/>
    <level value="50"  hp="812.55"  mp="368.1"  cp="325.02"  hpRegen="6.4"  mpRegen="2.1" cpRegen="5.5"/>
    <level value="51"  hp="830.75"  mp="376.5"  cp="332.3"   hpRegen="6.5"  mpRegen="2.4" cpRegen="6.5"/>
    <level value="52"  hp="849.08"  mp="384.96" cp="339.632" hpRegen="6.6"  mpRegen="2.4" cpRegen="6.5"/>
    <level value="53"  hp="867.54"  mp="393.48" cp="347.016" hpRegen="6.7"  mpRegen="2.4" cpRegen="6.5"/>
    <level value="54"  hp="886.13"  mp="402.06" cp="354.452" hpRegen="6.8"  mpRegen="2.4" cpRegen="6.5"/>
    <level value="55"  hp="904.85"  mp="410.7"  cp="361.94"  hpRegen="6.9"  mpRegen="2.4" cpRegen="6.5"/>
    <level value="56"  hp="923.7"   mp="419.4"  cp="369.48"  hpRegen="7.0"  mpRegen="2.4" cpRegen="6.5"/>
    <level value="57"  hp="942.68"  mp="428.16" cp="377.072" hpRegen="7.1"  mpRegen="2.4" cpRegen="6.5"/>
    <level value="58"  hp="961.79"  mp="436.98" cp="384.716" hpRegen="7.2"  mpRegen="2.4" cpRegen="6.5"/>
    <level value="59"  hp="981.03"  mp="445.86" cp="392.412" hpRegen="7.3"  mpRegen="2.4" cpRegen="6.5"/>
    <level value="60"  hp="1000.4"  mp="454.8"  cp="400.16"  hpRegen="7.4"  mpRegen="2.4" cpRegen="6.5"/>
    <level value="61"  hp="1019.9"  mp="463.8"  cp="407.96"  hpRegen="7.5"  mpRegen="2.7" cpRegen="7.5"/>
    <level value="62"  hp="1039.53" mp="472.86" cp="415.812" hpRegen="7.6"  mpRegen="2.7" cpRegen="7.5"/>
    <level value="63"  hp="1059.29" mp="481.98" cp="423.716" hpRegen="7.7"  mpRegen="2.7" cpRegen="7.5"/>
    <level value="64"  hp="1079.18" mp="491.16" cp="431.672" hpRegen="7.8"  mpRegen="2.7" cpRegen="7.5"/>
    <level value="65"  hp="1099.2"  mp="500.4"  cp="439.68"  hpRegen="7.9"  mpRegen="2.7" cpRegen="7.5"/>
    <level value="66"  hp="1119.35" mp="509.7"  cp="447.74"  hpRegen="8.0"  mpRegen="2.7" cpRegen="7.5"/>
    <level value="67"  hp="1139.63" mp="519.06" cp="455.852" hpRegen="8.1"  mpRegen="2.7" cpRegen="7.5"/>
    <level value="68"  hp="1160.04" mp="528.48" cp="464.016" hpRegen="8.2"  mpRegen="2.7" cpRegen="7.5"/>
    <level value="69"  hp="1180.58" mp="537.96" cp="472.232" hpRegen="8.3"  mpRegen="2.7" cpRegen="7.5"/>
    <level value="70"  hp="1201.25" mp="547.5"  cp="480.5"   hpRegen="8.4"  mpRegen="2.7" cpRegen="7.5"/>
    <level value="71"  hp="1222.05" mp="557.1"  cp="488.82"  hpRegen="8.5"  mpRegen="3.0" cpRegen="8.5"/>
    <level value="72"  hp="1242.98" mp="566.76" cp="497.192" hpRegen="8.6"  mpRegen="3.0" cpRegen="8.5"/>
    <level value="73"  hp="1264.04" mp="576.48" cp="505.616" hpRegen="8.7"  mpRegen="3.0" cpRegen="8.5"/>
    <level value="74"  hp="1285.23" mp="586.26" cp="514.092" hpRegen="8.8"  mpRegen="3.0" cpRegen="8.5"/>
    <level value="75"  hp="1306.55" mp="596.1"  cp="522.62"  hpRegen="8.9"  mpRegen="3.0" cpRegen="8.5"/>
    <level value="76"  hp="1328.0"  mp="606.0"  cp="531.2"   hpRegen="9.0"  mpRegen="3.0" cpRegen="8.5"/>
    <level value="77"  hp="1349.58" mp="615.96" cp="539.832" hpRegen="9.1"  mpRegen="3.0" cpRegen="8.5"/>
    <level value="78"  hp="1371.29" mp="625.98" cp="548.516" hpRegen="9.2"  mpRegen="3.0" cpRegen="8.5"/>
    <level value="79"  hp="1393.13" mp="636.06" cp="557.252" hpRegen="9.3"  mpRegen="3.0" cpRegen="8.5"/>
    <level value="80"  hp="1415.1"  mp="646.2"  cp="566.04"  hpRegen="9.4"  mpRegen="3.0" cpRegen="8.5"/>
    <level value="81"  hp="1437.2"  mp="656.4"  cp="574.88"  hpRegen="9.5"  mpRegen="3.0" cpRegen="8.5"/>
    <level value="82"  hp="1459.43" mp="666.66" cp="583.772" hpRegen="9.6"  mpRegen="3.0" cpRegen="8.5"/>
    <level value="83"  hp="1481.79" mp="676.98" cp="592.716" hpRegen="9.7"  mpRegen="3.0" cpRegen="8.5"/>
    <level value="84"  hp="1504.28" mp="687.36" cp="601.712" hpRegen="9.8"  mpRegen="3.0" cpRegen="8.5"/>
    <level value="85"  hp="1526.9"  mp="697.8"  cp="610.76"  hpRegen="9.9"  mpRegen="3.0" cpRegen="8.5"/>
</classInfo>