<?xml version='1.0' encoding='utf-8'?>

<classInfo classId="53" name="Dwarf Fighter" classLevel="1"  xmlns:xsi="http://www.w3.org/2001/XMLSchema-instance" xmlns="http://la2j.org" xsi:schemaLocation="http://la2j.org classInfo.xsd">
    <level value="1" hp="80.0" mp="30.0" cp="56.0" hpRegen="2.0" mpRegen="0.9" cpRegen="2.0" />
    <level value="2" hp="92.74" mp="35.46" cp="64.918" hpRegen="2.05" mpRegen="0.9" cpRegen="2.0" />
    <level value="3" hp="105.62" mp="40.98" cp="73.934" hpRegen="2.1" mpRegen="0.9" cpRegen="2.0" />
    <level value="4" hp="118.64" mp="46.56" cp="83.048" hpRegen="2.15" mpRegen="0.9" cpRegen="2.0" />
    <level value="5" hp="131.8" mp="52.2" cp="92.26" hpRegen="2.2" mpRegen="0.9" cpRegen="2.0" />
    <level value="6" hp="145.1" mp="57.9" cp="101.57" hpRegen="2.25" mpRegen="0.9" cpRegen="2.0" />
    <level value="7" hp="158.54" mp="63.66" cp="110.978" hpRegen="2.3" mpRegen="0.9" cpRegen="2.0" />
    <level value="8" hp="172.12" mp="69.48" cp="120.484" hpRegen="2.35" mpRegen="0.9" cpRegen="2.0" />
    <level value="9" hp="185.84" mp="75.36" cp="130.088" hpRegen="2.4" mpRegen="0.9" cpRegen="2.0" />
    <level value="10" hp="199.7" mp="81.3" cp="139.79" hpRegen="2.45" mpRegen="0.9" cpRegen="2.0" />
    <level value="11" hp="213.7" mp="87.3" cp="149.59" hpRegen="2.5" mpRegen="1.2" cpRegen="2.5" />
    <level value="12" hp="227.84" mp="93.36" cp="159.488" hpRegen="2.6" mpRegen="1.2" cpRegen="2.5" />
    <level value="13" hp="242.12" mp="99.48" cp="169.484" hpRegen="2.7" mpRegen="1.2" cpRegen="2.5" />
    <level value="14" hp="256.54" mp="105.66" cp="179.578" hpRegen="2.8" mpRegen="1.2" cpRegen="2.5" />
    <level value="15" hp="271.1" mp="111.9" cp="189.77" hpRegen="2.9" mpRegen="1.2" cpRegen="2.5" />
    <level value="16" hp="285.8" mp="118.2" cp="200.06" hpRegen="3.0" mpRegen="1.2" cpRegen="2.5" />
    <level value="17" hp="300.64" mp="124.56" cp="210.448" hpRegen="3.1" mpRegen="1.2" cpRegen="2.5" />
    <level value="18" hp="315.62" mp="130.98" cp="220.934" hpRegen="3.2" mpRegen="1.2" cpRegen="2.5" />
    <level value="19" hp="330.74" mp="137.46" cp="231.518" hpRegen="3.3" mpRegen="1.2" cpRegen="2.5" />
    <level value="20" hp="346.0" mp="144.0" cp="242.2" hpRegen="3.4" mpRegen="1.2" cpRegen="2.5" />
    <level value="21" hp="361.4" mp="150.6" cp="252.98" hpRegen="3.5" mpRegen="1.5" cpRegen="3.5" />
    <level value="22" hp="376.94" mp="157.26" cp="263.858" hpRegen="3.6" mpRegen="1.5" cpRegen="3.5" />
    <level value="23" hp="392.62" mp="163.98" cp="274.834" hpRegen="3.7" mpRegen="1.5" cpRegen="3.5" />
    <level value="24" hp="408.44" mp="170.76" cp="285.908" hpRegen="3.8" mpRegen="1.5" cpRegen="3.5" />
    <level value="25" hp="424.4" mp="177.6" cp="297.08" hpRegen="3.9" mpRegen="1.5" cpRegen="3.5" />
    <level value="26" hp="440.5" mp="184.5" cp="308.35" hpRegen="4.0" mpRegen="1.5" cpRegen="3.5" />
    <level value="27" hp="456.74" mp="191.46" cp="319.718" hpRegen="4.1" mpRegen="1.5" cpRegen="3.5" />
    <level value="28" hp="473.12" mp="198.48" cp="331.184" hpRegen="4.2" mpRegen="1.5" cpRegen="3.5" />
    <level value="29" hp="489.64" mp="205.56" cp="342.748" hpRegen="4.3" mpRegen="1.5" cpRegen="3.5" />
    <level value="30" hp="506.3" mp="212.7" cp="354.41" hpRegen="4.4" mpRegen="1.5" cpRegen="3.5" />
    <level value="31" hp="523.1" mp="219.9" cp="366.17" hpRegen="4.5" mpRegen="1.8" cpRegen="4.5" />
    <level value="32" hp="540.04" mp="227.16" cp="378.028" hpRegen="4.6" mpRegen="1.8" cpRegen="4.5" />
    <level value="33" hp="557.12" mp="234.48" cp="389.984" hpRegen="4.7" mpRegen="1.8" cpRegen="4.5" />
    <level value="34" hp="574.34" mp="241.86" cp="402.038" hpRegen="4.8" mpRegen="1.8" cpRegen="4.5" />
    <level value="35" hp="591.7" mp="249.3" cp="414.19" hpRegen="4.9" mpRegen="1.8" cpRegen="4.5" />
    <level value="36" hp="609.2" mp="256.8" cp="426.44" hpRegen="5.0" mpRegen="1.8" cpRegen="4.5" />
    <level value="37" hp="626.84" mp="264.36" cp="438.788" hpRegen="5.1" mpRegen="1.8" cpRegen="4.5" />
    <level value="38" hp="644.62" mp="271.98" cp="451.234" hpRegen="5.2" mpRegen="1.8" cpRegen="4.5" />
    <level value="39" hp="662.54" mp="279.66" cp="463.778" hpRegen="5.3" mpRegen="1.8" cpRegen="4.5" />
    <level value="40" hp="680.6" mp="287.4" cp="476.42" hpRegen="5.4" mpRegen="1.8" cpRegen="4.5" />
    <level value="41" hp="698.8" mp="295.2" cp="489.16" hpRegen="5.5" mpRegen="2.1" cpRegen="5.5" />
    <level value="42" hp="717.14" mp="303.06" cp="501.998" hpRegen="5.6" mpRegen="2.1" cpRegen="5.5" />
    <level value="43" hp="735.62" mp="310.98" cp="514.934" hpRegen="5.7" mpRegen="2.1" cpRegen="5.5" />
    <level value="44" hp="754.24" mp="318.96" cp="527.968" hpRegen="5.8" mpRegen="2.1" cpRegen="5.5" />
    <level value="45" hp="773.0" mp="327.0" cp="541.1" hpRegen="5.9" mpRegen="2.1" cpRegen="5.5" />
    <level value="46" hp="791.9" mp="335.1" cp="554.33" hpRegen="6.0" mpRegen="2.1" cpRegen="5.5" />
    <level value="47" hp="810.94" mp="343.26" cp="567.658" hpRegen="6.1" mpRegen="2.1" cpRegen="5.5" />
    <level value="48" hp="830.12" mp="351.48" cp="581.084" hpRegen="6.2" mpRegen="2.1" cpRegen="5.5" />
    <level value="49" hp="849.44" mp="359.76" cp="594.608" hpRegen="6.3" mpRegen="2.1" cpRegen="5.5" />
    <level value="50" hp="868.9" mp="368.1" cp="608.23" hpRegen="6.4" mpRegen="2.1" cpRegen="5.5" />
    <level value="51" hp="888.5" mp="376.5" cp="621.95" hpRegen="6.5" mpRegen="2.4" cpRegen="6.5" />
    <level value="52" hp="908.24" mp="384.96" cp="635.768" hpRegen="6.6" mpRegen="2.4" cpRegen="6.5" />
    <level value="53" hp="928.12" mp="393.48" cp="649.684" hpRegen="6.7" mpRegen="2.4" cpRegen="6.5" />
    <level value="54" hp="948.14" mp="402.06" cp="663.698" hpRegen="6.8" mpRegen="2.4" cpRegen="6.5" />
    <level value="55" hp="968.3" mp="410.7" cp="677.81" hpRegen="6.9" mpRegen="2.4" cpRegen="6.5" />
    <level value="56" hp="988.6" mp="419.4" cp="692.02" hpRegen="7.0" mpRegen="2.4" cpRegen="6.5" />
    <level value="57" hp="1009.04" mp="428.16" cp="706.328" hpRegen="7.1" mpRegen="2.4" cpRegen="6.5" />
    <level value="58" hp="1029.62" mp="436.98" cp="720.734" hpRegen="7.2" mpRegen="2.4" cpRegen="6.5" />
    <level value="59" hp="1050.34" mp="445.86" cp="735.238" hpRegen="7.3" mpRegen="2.4" cpRegen="6.5" />
    <level value="60" hp="1071.2" mp="454.8" cp="749.84" hpRegen="7.4" mpRegen="2.4" cpRegen="6.5" />
    <level value="61" hp="1092.2" mp="463.8" cp="764.54" hpRegen="7.5" mpRegen="2.7" cpRegen="7.5" />
    <level value="62" hp="1113.34" mp="472.86" cp="779.338" hpRegen="7.6" mpRegen="2.7" cpRegen="7.5" />
    <level value="63" hp="1134.62" mp="481.98" cp="794.234" hpRegen="7.7" mpRegen="2.7" cpRegen="7.5" />
    <level value="64" hp="1156.04" mp="491.16" cp="809.228" hpRegen="7.8" mpRegen="2.7" cpRegen="7.5" />
    <level value="65" hp="1177.6" mp="500.4" cp="824.32" hpRegen="7.9" mpRegen="2.7" cpRegen="7.5" />
    <level value="66" hp="1199.3" mp="509.7" cp="839.51" hpRegen="8.0" mpRegen="2.7" cpRegen="7.5" />
    <level value="67" hp="1221.14" mp="519.06" cp="854.798" hpRegen="8.1" mpRegen="2.7" cpRegen="7.5" />
    <level value="68" hp="1243.12" mp="528.48" cp="870.184" hpRegen="8.2" mpRegen="2.7" cpRegen="7.5" />
    <level value="69" hp="1265.24" mp="537.96" cp="885.668" hpRegen="8.3" mpRegen="2.7" cpRegen="7.5" />
    <level value="70" hp="1287.5" mp="547.5" cp="901.25" hpRegen="8.4" mpRegen="2.7" cpRegen="7.5" />
    <level value="71" hp="1309.9" mp="557.1" cp="916.93" hpRegen="8.5" mpRegen="3.0" cpRegen="8.5" />
    <level value="72" hp="1332.44" mp="566.76" cp="932.708" hpRegen="8.6" mpRegen="3.0" cpRegen="8.5" />
    <level value="73" hp="1355.12" mp="576.48" cp="948.584" hpRegen="8.7" mpRegen="3.0" cpRegen="8.5" />
    <level value="74" hp="1377.94" mp="586.26" cp="964.558" hpRegen="8.8" mpRegen="3.0" cpRegen="8.5" />
    <level value="75" hp="1400.9" mp="596.1" cp="980.63" hpRegen="8.9" mpRegen="3.0" cpRegen="8.5" />
    <level value="76" hp="1424.0" mp="606.0" cp="996.8" hpRegen="9.0" mpRegen="3.0" cpRegen="8.5" />
    <level value="77" hp="1447.24" mp="615.96" cp="1013.068" hpRegen="9.1" mpRegen="3.0" cpRegen="8.5" />
    <level value="78" hp="1470.62" mp="625.98" cp="1029.434" hpRegen="9.2" mpRegen="3.0" cpRegen="8.5" />
    <level value="79" hp="1494.14" mp="636.06" cp="1045.898" hpRegen="9.3" mpRegen="3.0" cpRegen="8.5" />
    <level value="80" hp="1517.8" mp="646.2" cp="1062.46" hpRegen="9.4" mpRegen="3.0" cpRegen="8.5" />
    <level value="81" hp="1541.6" mp="656.4" cp="1079.12" hpRegen="9.5" mpRegen="3.0" cpRegen="8.5" />
    <level value="82" hp="1565.54" mp="666.66" cp="1095.878" hpRegen="9.6" mpRegen="3.0" cpRegen="8.5" />
    <level value="83" hp="1589.62" mp="676.98" cp="1112.734" hpRegen="9.7" mpRegen="3.0" cpRegen="8.5" />
    <level value="84" hp="1613.84" mp="687.36" cp="1129.688" hpRegen="9.8" mpRegen="3.0" cpRegen="8.5" />
    <level value="85" hp="1638.2" mp="697.8" cp="1146.74" hpRegen="9.9" mpRegen="3.0" cpRegen="8.5" />
</classInfo>
